ItemName,Description,Value
Institution Name,,JPMORGAN CHASE & CO.
Street Address,,383 MADISON AVENUE
City,,NEW YORK
State,,NY
Zip Code,,10179
Report Date,Reporting date in numeric format,20201231
ID_RSSD,Reporting entity identifier,1039502
BHCK0081,NONINTEREST BEARING BALANCES AND CURRENCY AND COIN DUE FROM DEPOSITORY INSTITUTIONS (BHC CONSOLIDATED),24874000
BHCK0395,INT-BEARING BALANCES IN U.S. OFFICES (BHC CONSOLIDATED),280339000
BHCK0397,INTEREST-BEARING BALANCES IN FOREIGN OFFICES (BHC CONSOLIDATED),223829000
BHCK2122,TOAL LOANS AND LEASES HELD FOR INVESTMENT AND HELD FOR SALE (BHC CONSOLIDATED),1060578000
BHCK3123,ALLOWANCE FOR LOANS AND LEASE LOSSES (BALANCE AT END OF PERIOD) (BHC CONSOLIDATED),28328000
BHCK3128,ALLOCATED TRANSFER RISK RESERVE (BALANCE AT END OF PERIOD) (BHC CONSOLIDATED),0
BHCK2145,"PREMISES AND FIXED ASSETS, INCLUDING CAPITAL LEASES (BHC CONSOLIDATED)",23678000
BHCK2150,TOTAL OTHER REAL ESTATE OWNED (BHC CONSOLIDATED),265000
BHCK2130,INVESTMENTS IN UNCONSOLIDATED SUBSIDIARIES AND ASSOCIATED COMPANIES (BHC CONSOLIDATED),10911000
BHCK3164,MORTGAGE SERVICING ASSETS (BHC CONSOLIDATED),3276000
BHCK3163,GOODWILL (BHC CONSOLIDATED),49248000
BHCK2160,OTHER ASSETS (BHC CONSOLIDATED),174556000
BHCK2170,TOTAL ASSETS (BHC CONSOLIDATED),3386071000
BHDM6631,NONINTEREST-BEARING DEPOSITS (BHC CONSOL. U.S. OFC),572711000
BHDM6636,INTEREST-BEARING DEPOSITS (BHC CONSOL. U.S. OFC),1197032000
BHFN6631,NONINTEREST-BEARING DEPOSITS (BHC CONSOL. FOREIGN OFC.),23435000
BHFN6636,INTEREST-BEARING DEPOSITS (BHC CONSOL. FOREIGN OFC.),351079000
BHCK2309,COMMERCIAL PAPER (BHC CONSOLIDATED),22554000
BHCK2332,OTHER BORROWED MONEY WITH A REMAINING MATURITY OF 1 YR OR LESS (BHC CONSOLIDATED),63590000
BHCK2333,OTHER BORROWED MONEY WITH A REMAINING MATURITY OF > 1 YEAR (BHC CONSOLIDATED),236720000
BHCK4062,SUBORDINATED NOTES AND DEBENTURES (BHC CONSOLIDATED),21607000
BHCK3000,NONCONTROLLING (MINORITY) INTERESTS IN CONSOLIDATED SUBSIDIARIES (BHC CONSOLIDATED),132000
BHCK2948,TOTAL LIABILITIES (BHC CONSOLIDATED),3106585000
BHCK3283,PERPETUAL PREFERRED STOCK (BHC CONSOLIDATED),30063000
BHCK3230,COMMON STOCK (BHC CONSOLIDATED),4105000
BHCK3240,SURPLUS (BHC CONSOLIDATED),88394000
BHCK3247,UNDIVIDED PROFITS & CAPITAL RESERVES (BHC CONSOLIDATED),236990000
BHCK3210,TOTAL BANK HOLDING COMPANY EQUITY CAPITAL (BHC CONSOLIDATED),279354000
BHCK3300,"TOT LIAB, RESERVE & CAPITAL ACCOUNTS (BHC CONSOLIDATED)",3386071000
BHCK2750,OTHER LIABILITIES (BHC CONSOLIDATED),232715000
BHCK0383,DEBT SECURITIES WITH REMAINING MATURITY OF 1 YEAR OR LESS (BHC CONSOLIDATED),80134000
BHCK0384,DEBT SECURITIES WITH REMAINING MATURITY OF 1-5 YEARS (BHC CONSOLIDATED),167171000
BHCK0387,DEBT SECURITIES WITH REMAINING MATURITY OF 5+ YEARS (BHC CONSOLIDATED),342773000
BHCK0416,PLEDGED SECURITIES (BHC CONSOLIDATED),80262000
BHCK1410,LOANS SECURED BY REAL ESTATE (BHC CONSOLIDATED),370192000
BHCK1763,COMMERCIAL AND INDUSTRIAL LOANS TO U.S. ADDRESSEES (DOMICILE) (BHC CONSOLIDATED),149693000
BHCK1764,COMMERCIAL AND INDUSTRIAL LOANS TO NON-U.S. ADDRESSEES (DOMICILE) (BHC CONSOLIDATED),44614000
BHCK1590,LOANS TO FINANCE AGRICULTURAL PRODUCTION AND OTHER LOANS TO FARMERS (BHC CONSOLIDATED),662000
BHCK2081,LOANS TO FOREIGN GOVERNMENTS AND OFFICIAL INSTITUTIONS (BHC CONSOLIDATED),2595000
BHCK2123,UNEARNED INCOME ON LOANS (BHC CONSOLIDATED),0
BHDM1766,"C&I LOANS, ALL OTHER (BHC CONSOL. U.S. OFC)",155858000
BHDM1590,LOANS TO FINANCE AGRICULTURAL PROD (BHC CONSOL. U.S. OFC),649000
BHDM1975,"LOANS TO INDIVIDUALS, PERSONAL (BHC CONSOL. U.S. OFC)",197621000
BHDM2081,LNS TO FGN GOVTS & OFFICIAL INST (BHC CONSOL. U.S. OFC),0
BHDM2165,LEASE FINANCING RECEIVABLES (BHC CONSOL. U.S. OFC),376000
BHDM2123,UNEARNED INCOME ON LOANS (BHC CONSOL. U.S. OFC),0
BHDM2122,TOAL LOANS AND LEASES HELD FOR INVESTMENT AND HELD FOR SALE (BHC CONSOL. U.S. OFC),944153000
BHDM1420,R.E. LOANS-FARMLAND (BHC CONSOL. U.S. OFC),95000
BHDM1797,"REVOLVING, OPEN-END LNS SECD BY 1-4F (BHC CONSOL. U.S. OFC)",23740000
BHDM1460,R.E. LOANS MULTI-FAMILY (BHC CONSOL. U.S. OFC),73306000
BHCK2746,"LNS TO FINC COMMCL RE,CONSTRC&LD DEV (BHC CONSOLIDATED)",19419000
BHCB2210,NONINTEREST-BEARING BALANCES (BHC CONSOL. COMML. BANKS),572711000
BHCB3187,"INTEREST-BEARING DEMAND DEPOSITS, NOW, ATS, AND OTHER TRANSACTION ACCOUNTS (BHC CONSOL. COMML. BANKS)",288430000
BHCB2389,MONEY MARKET DEPOSIT ACCOUNTS AND OTHER SAVINGS ACCOUNTS (BHC CONSOL. COMML. BANKS),861250000
BHOD3189,NONINTEREST-BEARING BALANCES (BHC CONSOL. OTH.DEP.INST),0
BHOD3187,"INTEREST-BEARING DEMAND DEPOSITS, NOW, ATS, AND OTHER TRANSACTION ACCOUNTS (BHC CONSOL. OTH.DEP.INST)",0
BHOD2389,MONEY MARKET DEPOSIT ACCOUNTS AND OTHER SAVINGS ACCOUNTS (BHC CONSOL. OTH.DEP.INST),0
BHCK3197,EARNING ASSETS THAT ARE REPRICEABLE WITHIN 1 YEAR OR MATURE WITHIN 1 YEAR (BHC CONSOLIDATED),1654052000
BHCK3296,VAR RT INT-BRG DEPS RPRIC OR MAT 1YR (BHC CONSOLIDATED),394902000
BHCK3408,VARIABLE RATE PREFERRED STOCK (BHC CONSOLIDATED),23041000
BHCK3409,"LONG-TERM DEBT REPORTED IN SCHDULE HC, ITEM 19A ON THE BALANCE SHEET THAT IS SCHEDULED TO MATURE WITHIN ONE YEAR (BHC CONSOLIDATED)",0
BHCK3368,QTLY AVG OF TOTAL ASSETS (BHC CONSOLIDATED),3393112000
BHCK3517,AVERAGE BALS OF INT-BEARING DEPOSITS (BHC CONSOLIDATED),1184827000
BHCK3404,QTLY AVG OF INT-BRG DEPS IN FGN OFFC (BHC CONSOLIDATED),344239000
BHCK3519,AVERAGE BALS OF EQUITY CAPITAL (BHC CONSOLIDATED),271874000
BHCK2635,ALL OTHER BORROWED MONEY (QTRLY AVG) (BHC CONSOLIDATED),319422000
BHCK3365,FEDERAL FUNDS SOLD AND SECURITIES PURCHASED UNDER AGREEMENT TO RESELL (QTRLY AVG) (BHC CONSOLIDATED),476650000
BHCK3353,FEDERAL FUNDS PURCHASED AND SECURITIES SOLD UNDER AGREEMENTS TO REPURCHASE (QTRLY AVG) (BHC CONSOLIDATED),247276000
BHCK3298,"LONG-TERM DEBT THAT REPRICES WITHIN ONE YEAR INCLUDED IN ITEMS 16 AND 19A ON SCHEDULE HC, BALANCE SHEET (BHC CONSOLIDATED)",23781000
BHCK5369,LOANS AND LEASES HELD FOR SALE (BHC CONSOLIDATED),28568000
BHDM5367,ALL OTH LNS SECD BY 1-4FMLY-1ST LIEN (BHC CONSOL. U.S. OFC),217073000
BHDM5368,ALL OTH LNS SECD BY 1-4FMLY-JR LIENS (BHC CONSOL. U.S. OFC),790000
Report Date,,"December 31, 2020"
BHCK1754,AMORTIZED COST:  TOTAL (SUM OF 1 THROUGH 7),201899000
BHCK1773,"SECURITIES: AVAILABLE FOR SALE, FAIR VALUE (BHC CONSOLIDATED)",388178000
BHCK3548,TRADING LIABILITIES (BHC CONSOLIDATED),169933000
BHCK0211,"U.S. TREASURY SECURITIES, HELD TO MATURITY, AMORTIZED COST (BHC CONSOLIDATED)",53184000
BHCK0213,"U.S. TREASURY SECURITIES, HELD TO MATURITY, FAIR VALUE (BHC CONSOLIDATED)",53234000
BHCK1286,"U.S. TREASURY SECURITIES, AVAILABLE FOR SALE, AMORTIZED COST (BHC CONSOLIDATED)",199910000
BHCK1287,"U.S. TREASURY SECURITIES, AVAILABLE FOR SALE, FAIR VALUE (BHC CONSOLIDATED)",201951000
BHCK1778,AMORT COST OF HELD TO MAT SECURITIES SOLD OR TRANSFERRED TO AVAIL FOR SALE OR TRADING SECURITIES DURING CALENDAR YEAR TO DATE (BHC CONSOLIDATED),0
BHCK1752,"OTHER ASSETS, EQUITY INVESTMENTS WITHOUT DETERMINABLE FAIR VALUES (BHC CONSOLIDATED)",6889000
BHCK8782,STRUCTURED NOTES (INCLUDED IN THE HELD-TO-MATURITY AND AVAILABLE-FOR-SALE ACCOUNTS): AMORTIZED COST (BHC CONSOLIDATED),0
BHCK8783,STRUCTURED NOTES (INCLUDED IN THE HELD-TO-MATURITY AND AVAILABLE-FOR-SALE ACCOUNTS): FAIR VALUE (BHC CONSOLIDATED),0
BHCK3545,TRADING ASSETS (BHC CONSOLIDATED),502399000
BHCK3547,DERIVATIVES WITH A NEGATIVE FAIR VALUE (CONSOLIDATED) (BHC CONSOLIDATED),70284000
BHDM1288,LOANS TO DEPOSITORY INSTITUTIONS (BHC CONSOL. U.S. OFC),1885000
BHCK1292,LOANS TO U.S. BANKS AND OTHER U.S. DEPOSITORY INSTITUTIONS (BHC CONSOLIDATED),9000
BHCK1296,LOANS TO FOREIGN BANKS (BHC CONSOLIDATED),6971000
BHFNA245,FOREIGN OFFICE TIME DEPOSITS WITH A REMAINING MATURITY OF ONE YEAR OR LESS (BHC CONSOL. FOREIGN OFC.),48214000
BHCKB528,"LOANS AND LEASES, HELD FOR INVESTMENT (BHC CONSOLIDATED)",1032010000
BHCKB529,"LOANS AND LEASES, HELD FOR INVESTMENT, NET OF ALLOWANCE FOR LOAN AND LEASE LOSSES (BHC CONSOLIDATED)",1003682000
BHCK3190,OTHER BORROWED MONEY (BHC CONSOLIDATED),322864000
BHCKB530,"EQUITY CAPITAL, ACCUMULATED OTHER COMPREHENSIVE INCOME (BHC CONSOLIDATED)",7986000
BHCKA130,"EQUITY CAPITAL, OTHER EQUITY CAPITAL COMPONENTS (BHC CONSOLIDATED)",-88184000
BHCKB538,"LOANS TO INDIVIDUALS FOR HOUSEHOLD, FAMILY, AND OTHER PERSONAL EXPENDITURES, CREDIT CARDS (BHC CONSOLIDATED)",129662000
BHCKB539,"LOANS TO INDIVIDUALS FOR HOUSEHOLD, FAMILY, AND OTHER PERSONAL EXPENDITURES, OTHER REVOLVING CREDIT PLANS (BHC CONSOLIDATED)",15594000
BHCKB837,LOANS SECURED BY REAL ESTATE TO NON-US ADDRESSEES (DOMICILE) (BHC CONSOLIDATED),3793000
BHCK3401,AVERAGE BALANCE - TRADING ASSETS (BHC CONSOLIDATED),536741000
BHCKB985,AVERAGE BALANCE - OTHER EARNING ASSETS (BHC CONSOLIDATED),627892000
BHCBHK29,"TIME DEPOSITS $250,000 OR LESS (BHC CONSOL. COMML. BANKS) (BHC CONSOL. COMML. BANKS)",13662000
BHCBJ474,"TIME DEPOSITS $250,000+ (BHC CONSOL. COMML. BANKS) (BHC CONSOL. COMML. BANKS)",33690000
BHODHK29,"TIME DEPOSITS $250,000 OR LESS (BHC CONSOL. OTH.DEP.INST) (BHC CONSOL. OTH.DEP.INST)",0
BHODJ474,"TIME DEPOSITS $250,000+ (BHC CONSOL. OTH.DEP.INST) (BHC CONSOL. OTH.DEP.INST)",0
BHDMHK06,"BROKERED DEPOSITS $250,000 OR LESS WITH A REMAINING MATURITY OF ONE YEAR OR LESS (BHC CONSOL. U.S. OFC) (BHC CONSOL. U.S. OFC)",57654000
BHDMHK31,"BROKERED DEPOSITS $250,000 OR LESS WITH A REMAINING MATURITY OF MORE THAN ONE YEAR (BHC CONSOL. U.S. OFC) (BHC CONSOL. U.S. OFC)",8680000
BHDMHK32,"TIME DEPOSITS OF MORE THAN $250,000 WITH A REMAINING MATURITY OF ONE YEAR OR LESS (BHC CONSOL. U.S. OFC) (BHC CONSOL. U.S. OFC)",33121000
BHCK4059,"INT&FEE ON LNS IN FGN OFF,EDGE&AGREE AND IBFS (BHC CONSOLIDATED)",2254000
BHCK4065,INCOME FROM LEASE FINANCING RECEIVABLES (BHC CONSOLIDATED),11000
BHCK4069,INTEREST INCOME FROM TRADING ASSETS (BHC CONSOLIDATED),7832000
BHCK4020,INTEREST INCOME ON FEDERAL FUNDS SOLD AND SECURITIES PURCHASED UNDER AGREEMENTS TO RESELL (BHC CONSOLIDATED),2134000
BHCK4107,TOTAL INTEREST INCOME (BHC CONSOLIDATED),64960000
BHCK4172,"INTEREST ON DEPOSITS IN FOREIGN OFFICES, EDGE AND AGREEMENT SUBS, AND IBFS (BHC CONSOLIDATED)",69000
BHCK4180,EXPENSE OF FEDERAL FUNDS PURCHASED AND SECURITIES SOLD UNDER AGREEMENTS TO REPURCHASE (BHC CONSOLIDATED),1058000
BHCK4397,"INTEREST EXPENSE ON SUBORDINATED NOTES AND DEBENTURES, AND ON MANDATORY CONVERTIBLE SECURITIES (BHC CONSOLIDATED)",204000
BHCK4398,OTHER INTEREST EXPENSE (BHC CONSOLIDATED),0
BHCK4073,TOTAL INTEREST EXPENSE (BHC CONSOLIDATED),9960000
BHCK4074,NET INTEREST INCOME (BHC CONSOLIDATED),55000000
BHCK4230,PROVISIONS FOR CREDIT LOSSES FOR LOANS AND LEASES HELD FOR INVESTMENT,16291000
BHCK4070,INCOME FROM FIDUCIARY ACTIVITIES (BHC CONSOLIDATED),12988000
BHCK4483,"SERVICE CHGS, COMMISSIONS & FEES (BHC CONSOLIDATED)",4969000
BHCK4079,TOTAL NONINTEREST INCOME (BHC CONSOLIDATED),64169000
BHCK4135,SALARIES AND EMPLOYEE BENEFITS (BHC CONSOLIDATED),35556000
BHCK4217,"EXPENSE OF BANK PREMISES, FURNITURE, ETC. (BHC CONSOLIDATED)",6619000
BHCK4092,OTHER NONINTEREST EXPENSE (BHC CONSOLIDATED),25981000
BHCK4093,TOTAL NONINTEREST EXPENSE (BHC CONSOLIDATED),68238000
BHCK4301,Income (loss) before applicable income taxes and discontinued operations (sum of items 8.a and 8.b),35398000
BHCK4302,APPLICABLE INCOME TAXES (BHC CONSOLIDATED),6276000
BHCK4300,Income (loss) before discontinued operations (item 8.c minus item 9),29122000
BHCK4340,NET INCOME (LOSS) ATTRIBUTABLE TO BANK HOLDING COMPANY (BHC CONSOLIDATED),29131000
BHCK4507,TAX-EXEMPT SECS ISSUED BY ST&POL SUB (BHC CONSOLIDATED),1184000
BHCK4518,OTHER INTEREST INCOME (BHC CONSOLIDATED),578000
BHCK4519,NET INTEREST INCOME ON FULLY TAXABLE BASIS (BHC CONSOLIDATED),55418000
BHCK4592,"Net income before applicable income taxes, and discontinued operations (item 8.c. above) on a fully taxable equivalent basis",38760000
BHCK6761,INTEREST ON OTHER DEPOSITS IN DOMESTIC OFFICES (BHC CONSOLIDATED),1640000
BHCK3217,TOTAL BANK HOLDING COMPANY EQUITY CAPITAL MOST RECENTLY REPORTED FOR THE END OF PREVIOUS CALENDAR YEAR (BHC CONSOLIDATED),261330000
BHCK4356,"CHANGES IN EQUITY CAPITAL INCIDENT TO BUSINESS COMBINATIONS, NET (BHC CONSOLIDATED)",0
BHCK4598,CASH DIVIDENDS DECLARED ON PREFERRED STOCK (BHC CONSOLIDATED),1583000
BHCK4460,CASH DIVIDENDS DECLARED ON COMMON STOCK (BHC CONSOLIDATED),11111000
BHCK4782,SALES OF TREASURY STOCK (BHC CONSOLIDATED),1262000
BHCK4783,PURCHASES OF TREASURY STOCK (BHC CONSOLIDATED),6397000
BHCK4591,CHANGES TO OFFSETTING DEBT TO LIABILITY FOR ESOP DEBT GUARANTEED BY BHC (BHC CONSOLIDATED),0
BHCK3577,"SALE OF PERPETUAL PREFERRED STOCK, GROSS (BHC CONSOLIDATED)",4495000
BHCK3578,CONVERSION OR RETIREMENT OF PERPETUAL PREFERRED STOCK (BHC CONSOLIDATED),-1430000
BHCK3579,"SALE OF COMMON STOCK, GROSS (BHC CONSOLIDATED)",0
BHCK3580,CONVERSION OR RETIREMENT OF COMMON STOCK (BHC CONSOLIDATED),0
BHCK4652,"LOANS SECURED BY REAL ESTATE, NON-U.S. ADDRESSES: CHARGE-OFFS (BHC CONSOLIDATED)",0
BHCK4662,"LOANS SECURED BY REAL ESTATE, NON-U.S. ADDRESSES: RECOVERIES (BHC CONSOLIDATED)",0
BHCK4645,CHG-OFFS ON C&I LNS-U.S. ADDRESSES (BHC CONSOLIDATED),1091000
BHCK4617,RECOV ON C & I LNS-U.S. ADDRESSES (BHC CONSOLIDATED),160000
BHCK4646,CHG-OFFS ON C&I LNS-NON-U.S. ADDRES (BHC CONSOLIDATED),317000
BHCK4618,RECOV ON C & I LNS-NON-U.S. ADDRES (BHC CONSOLIDATED),23000
BHCK4655,CHARGE-OFFS ON LOANS TO FARMERS (BHC CONSOLIDATED),4000
BHCK4665,RECOVERIES ON LOANS TO FARMERS (BHC CONSOLIDATED),1000
BHCK4643,CHG-OFFS ON LNS TO FGN GOVTS & INST (BHC CONSOLIDATED),0
BHCK4627,RECOV ON LNS TO FGN GOVTS & INST (BHC CONSOLIDATED),0
BHCK4605,ALLOWANCE FOR LOAN AND LEASE LOSSES: RECOVERIES (BHC CONSOLIDATED),1577000
BHCK4635,ALLOWANCE FOR LOAN AND LEASE LOSSES: CHARGE-OFFS (BHC CONSOLIDATED),6836000
BHCK3584,CHG-OFFS ON LNS SECURED BY FARMLAND (BHC CONSOLIDATED),0
BHCK3585,RECVRS ON LNS SECURED BY FARMLAND (BHC CONSOLIDATED),0
BHCK3588,CHG-OFFS ON LNS SECD BY MULTI-FAMILY (BHC CONSOLIDATED),0
BHCK3589,RECVRS ON LNS SECD BY MULTI-FMLY RES (BHC CONSOLIDATED),3000
BHCK3581,OTHER ADJUSTMENTS TO EQUITY CAPITAL (BHC CONSOLIDATED),-110000
BHCK5411,"CHG-OFFS OF RVLVG,OPEN-END LNS SECD (BHC CONSOLIDATED)",121000
BHCK5412,"RECOVERS OF RVLVG,OPEN-END LNS SECD (BHC CONSOLIDATED)",146000
BHCK5409,"CHG-OFFS OF LNS TO FINC COMMCL RE,CO (BHC CONSOLIDATED)",0
BHCK5410,"RECOVERS OF LNS TO FINC COMMCL RE,CO (BHC CONSOLIDATED)",0
BHCK4644,CHG-OFFS ON ALL OTHER LOANS (BHC CONSOLIDATED),288000
BHCK4628,RECOV ON ALL OTHER LOANS (BHC CONSOLIDATED),54000
BHCK3521,REALIZED GAINS (LOSSES) ON HELD-TO-MATURITY SECURITIES (BHC CONSOLIDATED),0
BHCK3196,REALIZED GAINS (LOSSES) ON AVAILABLE-FOR-SALE SECURITIES (BHC CONSOLIDATED),802000
BHCK8560,OTHER NON-INTEREST INCOME: NET GAINS (LOSSES) ON SALES OF LOANS (BHC CONSOLIDATED),65000
BHCK8561,OTHER NON-INTEREST INCOME: NET GAINS (LOSSES) ON SALES OF OTHER REAL ESTATE OWNED (BHC CONSOLIDATED),6000
BHCK8562,1ST AMOUNT - OTHER NONINTEREST INCOME > 10% OF TOTAL (BHC CONSOLIDATED),5539000
BHCK8563,2ND AMOUNT - OTHER NONINTEREST INCOME > 10% OF TOTAL (BHC CONSOLIDATED),1512000
BHCK8564,3RD AMOUNT - OTHER NONINTEREST INCOME > 10% OF TOTAL (BHC CONSOLIDATED),1458000
BHCK8565,1ST AMOUNT - OTHER NONINTEREST EXPENSE > 10% OF TOTAL (BHC CONSOLIDATED),4255000
BHCK8566,2ND AMOUNT - OTHER NONINTEREST EXPENSE > 10% OF TOTAL (BHC CONSOLIDATED),2521000
BHCK8567,3RD AMOUNT - OTHER NONINTEREST EXPENSE > 10% OF TOTAL (BHC CONSOLIDATED),0
BHCK8757,TRADING REVENUE: INTEREST RATE EXPOSURES (BHC CONSOLIDATED),3028000
BHCK8758,TRADING REVENUE: FOREIGN EXCHANGE EXPOSURES (BHC CONSOLIDATED),4319000
BHCK8759,TRADING REVENUE: EQUITY SECURITY AND INDEX EXPOSURES (BHC CONSOLIDATED),7348000
BHCK8760,TRADING REVENUE: COMMODITY AND OTHER EXPOSURES (BHC CONSOLIDATED),2299000
BHCK8431,INCOME FROM THE SALE AND SERVICING OF MUTUAL FUNDS AND ANNUITIES (IN DOMESTIC OFFICES) (BHC CONSOLIDATED),4501000
BHCKA220,TRADING REVENUE (BHC CONSOLIDATED),19571000
BHCKA251,CREDIT LOSSES ON OFF-BALANCE SHEET DERIVATIVE CONTRACTS (BHC CONSOLIDATED),89000
BHCKA530,"SUBCHAPTER S ELECTION IN EFFECT FOR FEDERAL INCOME TAX PURPOSES FOR CURRENT YEAR (1=YES, 0=NO) (BHC CONSOLIDATED)",0
BHCK4115,INTEREST INCOME ON BALANCES DUE FROM DEPOSITORY INSTITUTIONS (BHC CONSOLIDATED),749000
BHCKB488,INTEREST & DIVIDEND INCOME ON US TREASURY SECURITIES AND US GOVERNMENT AGENCY OBLIGATIONS (EXCLUDE MORTGAGE-BACKED SECURITIES (BHC CONSOLIDATED),1733000
BHCKB489,INTEREST & DIVIDEND INCOME ON MORTGAGE-BACKED SECURITIES (BHC CONSOLIDATED),4864000
BHCK4060,INTEREST & DIVIDEND INCOME ON ALL OTHER SECURITIES (BHC CONSOLIDATED),2432000
BHCK4185,INTEREST ON TRADING LIABILITIES AND OTHER BORROWED MONEY (EXCLUDE SUBORDINATED NOTES AND DEBENTURES) (BHC CONSOLIDATED),6341000
BHCKB491,NONINTEREST INCOME: VENTURE CAPITAL REVENUE (BHC CONSOLIDATED),24000
BHCKB492,NONINTEREST INCOME: NET SERVICING FEES (BHC CONSOLIDATED),-1091000
BHCKB493,NONINTEREST INCOME: NET SECURITIZATION INCOME (BHC CONSOLIDATED),11000
BHCKB496,NONINTEREST INCOME: NET GAINS(LOSSES) ON SALES OF OTHER ASSETS (BHC CONSOLIDATED),-23000
BHCKB497,NONINTEREST INCOME: OTHER (BHC CONSOLIDATED),15334000
BHCKB983,"BENEFITS, LOSSES, AND EXPENSES FROM INSURANCE RELATED ACTIVITIES (BHC CONSOLIDATED)",0
BHCK4313,INCOME ON TAX-EXEMPT LOANS AND LEASES TO STATES AND POLITICAL SUBDIVISIONS IN THE US (BHC CONSOLIDATED),441000
BHCKB507,"CHANGES EQUITY CAPITAL, RESTATEMENTS DUE TO CORRECTIONS OF MATERIAL ACCOUNTING ERRORS AND CHANGES IN ACCOUNTING PRINCIPLES (BHC CONSOLIDATED)",-2650000
BHCKB508,"CHANGES IN EQUITY CAPITAL, BALANCE END OF PREVIOUS CALENDAR YEAR AS RESTATED (BHC CONSOLIDATED)",258680000
BHCKB511,"CHANGES IN EQUITY CAPITAL, OTHER COMPREHENSIVE INCOME (BHC CONSOLIDATED)",6417000
BHCKB512,LOANS SECURED BY REAL ESTATE: IN FOREIGN OFFICES CHARGE-OFFS (BHC CONSOLIDATED),0
BHCKB513,LOANS SECURED BY REAL ESTATE: IN FOREIGN OFFICES RECOVERIES (BHC CONSOLIDATED),0
BHCKB514,"LOANS TO INDIVIDUALS FOR HOUSEHOLD, FAMILY, AND OTHER PERSONAL EXPENDITURES: CREDIT CARDS CHARGE-OFFS (BHC CONSOLIDATED)",4585000
BHCKB515,"LOANS TO INDIVIDUALS FOR HOUSEHOLD, FAMILY, AND OTHER PERSONAL EXPENDITURES: CREDIT CARDS RECOVERIES (BHC CONSOLIDATED)",753000
BHCKB522,CHANGES IN ALLOWANCE FOR LOAN AND LEASE LOSSES: BALANCE MOST RECENTLY REPORTED AT END OF PREVIOUS YEAR (BHC CONSOLIDATED),13123000
BHCK8496,"SECURITIES ISSUED BY US STATE & POLITICAL SUBDIVISIONS, H-T-M, AMORTIZED COST (BHC CONSOLIDATED)",12808000
BHCK8497,"SECURITIES ISSUED BY US STATE & POLITICAL SUBDIVISIONS, H-T-M, FAIR VALUE (BHC CONSOLIDATED)",13271000
BHCK8498,"SECURITIES ISSUED BY US STATE & POLITICAL SUBDIVISIONS, A-F-S, AMORTIZED COST (BHC CONSOLIDATED)",18993000
BHCK8499,"SECURITIES ISSUED BY US STATE & POLITICAL SUBDIVISIONS, A-F-S, FAIR VALUE (BHC CONSOLIDATED)",20396000
BHCKB838,"ASSET-BACKED SECURITIES: CREDIT CARD RECEIVABLES, H-T-M AMORTIZED COST (BHC CONSOLIDATED)",0
BHCKB839,"ASSET-BACKED SECURITIES: CREDIT CARD RECEIVABLES, H-T-M FAIR VALUE (BHC CONSOLIDATED)",0
BHCKB840,"ASSET-BACKED SECURITIES: CREDIT CARD RECEIVABLES, A-F-S AMORTIZED COST (BHC CONSOLIDATED)",42000
BHCKB841,ASSET-BACKED SECURITIES: CREDIT CARD RECEIVABLES A-F-S FAIR VALUE (BHC CONSOLIDATED),42000
BHCKB842,"ASSET-BACKED SECURITIES: HOME EQUITY LINES, H-T-M AMORTIZED COST (BHC CONSOLIDATED)",0
BHCKB843,"ASSET-BACKED SECURITIES: HOME EQUITY LINES, H-T-M FAIR VALUE (BHC CONSOLIDATED)",0
BHCKB844,"ASSET-BACKED SECURITIES: HOME EQUITY LINES, A-F-S AMORTIZED COST (BHC CONSOLIDATED)",0
BHCKB845,"ASSET-BACKED SECURITIES: HOME EQUITY LINES, A-F-S FAIR VALUE (BHC CONSOLIDATED)",0
BHCKB846,"ASSET-BACKED SECURITIES: AUTOMOBILE LOANS, H-T-M AMORTIZED COST (BHC CONSOLIDATED)",0
BHCKB847,"ASSET-BACKED SECURITIES: AUTOMOBILE LOANS, H-T-M FAIR VALUE (BHC CONSOLIDATED)",0
BHCKB848,"ASSET-BACKED SECURITIES: AUTOMOBILE LOANS, A-F-S AMORTIZED COST (BHC CONSOLIDATED)",1287000
BHCKB849,"ASSET-BACKED SECURITIES: AUTOMOBILE LOANS, A-F-S FAIR VALUE (BHC CONSOLIDATED)",1300000
BHCKB850,"ASSET-BACKED SECURITIES: OTHER CONSUMER LOANS, H-T-M AMORTIZED COST (BHC CONSOLIDATED)",0
BHCKB851,"ASSET-BACKED SECURITIES: OTHER CONSUMER LOANS, H-T-M FAIR VALUE (BHC CONSOLIDATED)",0
BHCKB852,"ASSET-BACKED SECURITIES: OTHER CONSUMER LOANS, A-F-S AMORTIZED COST (BHC CONSOLIDATED)",3068000
BHCKB853,"ASSET-BACKED SECURITIES: OTHER CONSUMER LOANS, A-F-S FAIR VALUE (BHC CONSOLIDATED)",3115000
BHCKB854,"ASSET-BACKED SECURITIES: COMMERCIAL & INDUSTRIAL LOANS, H-T-M AMORTIZED COST (BHC CONSOLIDATED)",0
BHCKB855,"ASSET-BACKED SECURITIES: COMMERCIAL & INDUSTRIAL LOANS, H-T-M FAIR VALUE (BHC CONSOLIDATED)",0
BHCKB856,"ASSET-BACKED SECURITIES: COMMERCIAL & INDUSTRIAL LOANS, A-F-S AMORTIZED COST (BHC CONSOLIDATED)",88000
BHCKB857,"ASSET-BACKED SECURITIES: COMMERCIAL & INDUSTRIAL LOANS, A-F-S FAIR VALUE (BHC CONSOLIDATED)",89000
BHCKB858,"ASSET-BACKED SECURITIES: OTHER, H-T-M AMORTIZED COST (BHC CONSOLIDATED)",0
BHCKB859,"ASSET-BACKED SECURITIES: OTHER, H-T-M FAIR VALUE (BHC CONSOLIDATED)",0
BHCKB860,"ASSET-BACKED SECURITIES: OTHER, A-F-S AMORTIZED COST (BHC CONSOLIDATED)",1689000
BHCKB861,"ASSET-BACKED SECURITIES: OTHER, A-F-S FAIR VALUE (BHC CONSOLIDATED)",1703000
BHCK1737,"OTHER DOMESTIC DEBT SECURITIES, H-T-M, AMORTIZED COST (BHC CONSOLIDATED)",0
BHCK1738,"OTHER DOMESTIC DEBT SECURITIES, H-T-M, FAIR VALUE (BHC CONSOLIDATED)",0
BHCK1739,"OTHER DOMESTIC DEBT SECURITIES, A-F-S, AMORTIZED COST (BHC CONSOLIDATED)",66000
BHCK1741,"OTHER DOMESTIC DEBT SECURITIES, A-F-S, FAIR VALUE (BHC CONSOLIDATED)",65000
BHCK1742,"FOREIGN DEBT SECURITIES, H-T-M, AMORTIZED COST (BHC CONSOLIDATED)",0
BHCK1743,"FOREIGN DEBT SECURITIES, H-T-M, FAIR VALUE (BHC CONSOLIDATED)",0
BHCK1744,"FOREIGN DEBT SECURITIES, A-F-S, AMORTIZED COST (BHC CONSOLIDATED)",22736000
BHCK1746,"FOREIGN DEBT SECURITIES, A-F-S, FAIR VALUE (BHC CONSOLIDATED)",23079000
BHCK1771,"TOTAL HELD-TO-MATURITY SECURITIES, FAIR VALUE (BHC CONSOLIDATED)",205472000
BHCK1772,"TOTAL AVAILABLE-FOR-SALE SECURITIES, AMORTIZED COST (BHC CONSOLIDATED)",381729000
BHCKB990,"PROP & CASUALTY LIABILITIES - POLICY BENEFITS, RESERVES, AND LOSS ADJUSTED EXPENSES (BHC CONSOLIDATED)",39000
BHCKB991,PROP & CASUALTY LIABILITIES - UNEARNED PREMIUMS (BHC CONSOLIDATED),0
BHCKB992,LIFE & HEALTH ASSETS - SEPARATE ACCOUNT ASSETS (BHC CONSOLIDATED),3532000
BHCKB994,"LIFE & HEALTH LIABILITIES - POLICY BENEFITS, RESERVES, AND LOSS ADJUSTED EXPENSES (BHC CONSOLIDATED)",0
BHCKB996,LIFE & HEALTH LIABILITIES - SEPARATE ACCOUNT LIABILITIES (BHC CONSOLIDATED),3532000
BHCKB569,"DOES THE HOLDING COMPANY SELL PRIVATE LABEL OR THIRD PARTY MUTUAL FUNDS AND ANNUITIES ? (1=YES,0=NO) (BHC CONSOLIDATED)",1
BHCKB570,ASSETS UNDER MANAGEMENT IN PROPRIETARY MUTUAL FUNDS AND ANNUITIES (BHC CONSOLIDATED),1328981000
BHCKC079,TOTAL CHARGE-OFFS AND WRITE-DOWNS ARISING FROM TRANSFERS OF LOANS TO HELD-FOR-SALE ACCOUNT (BHC CONSOLIDATED),6836000
BHCK5523,WRITE-DOWNS ARISING FROM TRANSFERS OF LOANS TO THE HELD-FOR-SALE ACCOUNT (BHC CONSOLIDATED),0
BHCKC159,DO YOUR AGGREGATE NONFINANCIAL EQUITY INVESTMENTS EQUAL OR EXCEED THE LESSER OF $100 MILLION (ON AN ACQUISITION COST BASIS) OR 10% OF THE BHC'S CONSOLIDATED TIER 1 CAPITAL AS OF THE REPORT DATE? (1=YE,1
BHCKC161,"DOES THE BHC HOLD, DIRECT OR INDIRECT, ANY NONFINANCIAL EQUITY INVESTMENTS WITHIN A SMALL BUS INVEST CO (SIBC) OR UNDER SECTION 4(C)(6) OR 4(C)(7) OF BHC ACT, OR PURSUANT TO THE MERCHANT BANKING AUTHO",1
BHCKC216,NONINTEREST EXPENSE: GOODWILL IMPAIRMENT LOSSES (BHC CONSOLIDATED),0
BHCKC232,NONINTEREST EXPENSE: AMORTIZATION EXPENSE AND IMPAIRMENT LOSSES FOR OTHER INTANGIBLE ASSETS (BHC CONSOLIDATED),82000
BHCKC234,CLOSED-END LOANS SECURED BY 1-4 FAMILY RESIDENTIAL PROPERTIES: SECURED BY FIRST LIENS: CHARGE-OFFS (BHC CONSOLIDATED),95000
BHCKC217,CLOSED-END LOANS SECURED BY 1-4 FAMILY RESIDENTIAL PROPERTIES: SECURED BY FIRST LIENS: RECOVERIES (BHC CONSOLIDATED),218000
BHCKC235,CLOSED-END LOANS SECURED BY 1-4 FAMILY RESIDENTIAL PROPERTIES: SECURED BY JUNIOR LIENS: CHARGE-OFFS (BHC CONSOLIDATED),15000
BHCKC218,CLOSED-END LOANS SECURED BY 1-4 FAMILY RESIDENTIAL PROPERTIES: SECURED BY JUNIOR LIENS: RECOVERIES (BHC CONSOLIDATED),34000
BHCKC233,CHANGES IN ALLOWANCE FOR LOAN AND LEASE LOSSES: ADJUSTMENTS (BHC CONSOLIDATED),4173000
BHDMB987,FEDERAL FUNDS SOLD IN DOMESTIC OFFICES (BHC CONSOL. U.S. OFC),0
BHCKB989,SECURITIES PURCHASED UNDER AGREEMENT TO RESELL (BHC CONSOLIDATED),456919000
BHDMB993,FEDERAL FUNDS PURCHASED IN DOMESTIC OFFICES (BHC CONSOL. U.S. OFC),2446000
BHCKB995,SECURITES SOLD UNDER AGREEMENTS TO REPURCHASE (BHC CONSOLIDATED),212763000
BHCKHK03,"INTEREST ON TIME DEPOSITS OF $250,000 OR LESS (BHC CONSOLIDATED) (BHC CONSOLIDATED)",233000
BHCKHK04,"INTEREST ON TIME DEPOSITS MORE THAN $250,000 (BHC CONSOLIDATED) (BHC CONSOLIDATED)",415000
BHCKG300,MORTGAGE-BACKED SECURITIES (MBS): RESIDENTIAL PASS-THROUGH SECURITIES: GUARANTEED BY GNMA (HELD-TO-MATURITY: AMORTIZED COST) (BHC CONSOLIDATED),21631000
BHCKG301,MORTGAGE-BACKED SECURITIES (MBS): RESIDENTIAL PASS-THROUGH SECURITIES: GUARANTEED BY GNMA (HELD-TO-MATURITY: FAIR VALUE) (BHC CONSOLIDATED),21964000
BHCKG302,MORTGAGE-BACKED SECURITIES (MBS): RESIDENTIAL PASS-THROUGH SECURITIES: GUARANTEED BY GNMA (AVAILABLE-FOR-SALE: AMORTIZED COST) (BHC CONSOLIDATED),46738000
BHCKG303,MORTGAGE-BACKED SECURITIES (MBS): RESIDENTIAL PASS-THROUGH SECURITIES: GUARANTEED BY GNMA (AVAILABLE-FOR-SALE: FAIR VAULE) (BHC CONSOLIDATED),47468000
BHCKG304,MORTGAGE-BACKED SECURITIES (MBS): RESIDENTIAL PASS-THROUGH SECURITIES: ISSUED BY FNMA AND FHLMC (HELD-TO-MATURITY: AMORTIZED COST) (BHC CONSOLIDATED),72780000
BHCKG305,MORTGAGE-BACKED SECURITIES (MBS): RESIDENTIAL PASS-THROUGH SECURITIES: ISSUED BY FNMA AND FHLMC (HELD-TO-MATURITY: FAIR VALUE) (BHC CONSOLIDATED),74567000
